Question;	Answer1;	Answer2;	Answer3; CorrectAnswer;
Who was the antagonist in the Fallout 1?;Master;Enclave;Supermutants;1;
What or who was to be found in the Fallout 2?;Father;Son;G.E.C.K.;3;
Which vault was the hero of the Fallout 3 from?;13;101;111;2;
In which state are the Fallout New Vegas actions taking place?;Arizona;California;Nevada;3;
Continue list of factions from the Fallout 4: Brotherhood of Steel, The Railroad, Commonwealth Minutemen, ...;The Institute;The University;The College;1;
Which Fallout is the best?;Fallout 2;Fallout 4;Fallout New Vegas;0;
